{
  "customer_insight": "已知：客户经常跨地点开会，主要处理会议文档和表格，担心现有软件、文件及外设适配。\n已确认优先级：软件与外设适配＞屏幕阅读＞携带。首要任务是验证原有工作流程，不能用轻便替代适配判断。\n待确认：软件与插件名称、版本、文件格式、会议与外设条件、预算、具体销售配置；没有实测结果。",
  "strategy": "先从会前打开文件、会中修改记录、会后保存分享的工作流程切入，再给屏幕阅读与携带体验建议。产品采用HarmonyOS 6、3:2屏幕，圆键盘版本约1.33 kg（含电池且有重量差异条件）[S1]。这些规格不证明原有软件、宏、插件或外设可用。\n公众号采用导语、三个小节和明确的体验清单，配两张圆键盘外观图；不使用小红书标签或虚构亲测叙述。客户把携带排在第三，本稿不强推瓶水类比，优先解释任务验证。来源图不是会议实拍或软件运行截图。\n本文是手写理想样例，需用真实ima返回内容替换夹具并人工复核。",
  "content": {
    "title": "换电脑前，先把下一场会议完整走一遍",
    "body": "出门开会，真正让人放心的，不只是设备放进包里的那一刻，而是文件能否顺利打开、修改后能否保留格式，以及现场外设能否按计划工作。如果这些问题还没有确认，可以先带着任务清单体验，再决定是否适合换机。\n\n先核对工作流程，再讨论配置\nHUAWEI MateBook 14（鸿蒙版）采用HarmonyOS 6[S1]。系统名称不能直接回答你常用的软件、插件和文件是否适配。建议先列出每天离不开的应用、具体版本、文件格式和连接设备；涉及单位账号、网络或管理要求时，也需要向获授权人员确认。没有这些信息，不应把“可以办公”扩展成“你的工作流程全部可用”。\n\n把屏幕放回真实文档中\n本次资料列明该型号屏幕比例为3:2[S1]。是否符合你的阅读习惯，可以用一份脱敏会议材料和一张常用表格来判断：观察字号、缩放和窗口切换方式。我们没有相同条件下的效率测试，因此不将屏幕规格换算成节省多少分钟或提升多少效率。\n\n最后再把出行装备装进包\n圆键盘版本约1.33 kg（含电池），实际重量因配置、制造工艺和测量方法不同可能有差异[S1]。出行还要携带充电器等物品，建议把实际组合一起考虑；如果样机不是目标配置，就记录待体验，不用其他款式的手感代替。\n\n到店前可以准备：常用软件及版本清单、经授权的脱敏文件、必要的外设信息。先确认现场具备演示条件，再按打开、修改、保存的顺序验证。未能完成的步骤单独记录，既不急着下结论，也不把计划中的演示当作已经通过的测试。",
    "call_to_action": "把最担心的一项工作任务告诉我们，先核对演示条件，再约一次围绕真实任务的到店体验。"
  },
  "image_plan": [
    {
      "source_ref": "I1",
      "position": "导语之后、首个小节之前：展示讨论型号的外观。",
      "caption": "HUAWEI MateBook 14（鸿蒙版）原野绿圆键盘外观示意，不是会议现场图。"
    },
    {
      "source_ref": "I2",
      "position": "“最后再把出行装备装进包”小节之后：补充同型号圆键盘外观。",
      "caption": "樱粉金圆键盘款式示意；图片不能证明携带感受、软件运行或外设适配。"
    }
  ],
  "sales_plan": {
    "quote": "暂不报价：本次没有当期具体SKU、价格和优惠适用规则，预算也未确认。先确认键盘、内存、存储和屏幕版本，再由获授权人员核对有效价格及优惠条件；不自动计算或叠加优惠。",
    "demo_script": "0—30秒：确认最重要的工作任务、软件版本、文件和外设条件；若信息不齐，先记录而不承诺兼容。\n30—90秒：核对目标样机和使用权限；用获授权的脱敏文档按打开、修改、保存顺序操作，记录实际软件版本与失败步骤；缺软件、账号或样例就转为待验证。\n90—150秒：在前述条件满足时查看表格字号、缩放与窗口安排；允许拿取且装备齐全时再试装包。不得仅凭屏幕比例或重量宣布效率提升。\n150—180秒：与客户分别记录已完成、未完成和需要单位授权人员确认的项目，约定是否继续沟通及下一步。"
  },
  "follow_up": [
    {
      "day": 1,
      "message": "方便的话，请提供常用软件及版本、文件格式和外设名称即可，不需要提供账号密码或未脱敏业务文件，我们据此准备验证清单。"
    },
    {
      "day": 3,
      "message": "工作流程里还有哪些环节没确认？如果希望到店，我们先核对目标样机、软件和外设演示条件，再约时间。"
    },
    {
      "day": 7,
      "message": "换机计划或必要软件清单有变化吗？仍需验证的项目可以继续整理；若目前不需要跟进，也可以告诉我们暂停联系。"
    }
  ],
  "source_refs": [
    "S1",
    "I1",
    "I2"
  ],
  "pending_confirmation": [
    "确认软件、插件、文件格式、外设和单位管理条件；现有证据没有证明这些任务已适配。",
    "确认预算与具体SKU、当期价格和优惠规则，暂不报价。",
    "两张本地圆键盘外观图须在真实ima返回中重新映射和核对使用权限，不当作软件运行截图。",
    "样例不是实测或真实生成记录，实际成稿需重新检索、生成及人工复核。",
    "跟进草稿须在获得联系许可且符合实际进度时使用，不自动发送。"
  ]
}
