{
  "customer_insight": "已知：目标人群是第一次购机的大学新生；每天携带电脑上课，用于课堂笔记和小组作业，顾虑是常用软件能否适配。\n已确认优先级：轻便＞常用软件适配＞屏幕，来自本次notes。轻便决定内容开篇，软件适配是购买前必须核对的条件，不能因排序第二而跳过。\n待确认：专业、常用软件及版本、预算、具体键盘/内存/存储/屏幕款式。没有证据支持客户已选定配置或已经体验满意。",
  "strategy": "主线：把电脑放进“宿舍—教室—图书馆”的一天，先解释携带重量，再安排常用任务验证，最后给到店清单；不扩展无证据的性能、续航或优惠。\n事实与换算：本地示例资料载明圆键盘版本约1.33 kg（含电池），方键盘版本约1.32 kg，实际重量因配置、制造工艺和测量方法不同可能有差异[S1]。正文选圆键盘口径作等重示意：1.33×1000=1330 g；按水约1 g/mL、每份500 mL计算，1330÷500=2.66，取一位小数约2.7份500 mL水。只比较电脑自身重量，不含瓶、充电器及其他配件，不表示比旧电脑轻了这些重量，也不证明疲劳或效率改变。\n平台：小红书用短标题、场景化短段落、一个生活比喻和三个相关话题；三张来源图均为产品外观，不能冒充校园实拍。前两张是圆键盘外观，第三张用于方/圆键盘版本辨别；不让图片替代规格证据。\n本结果是人工设计样例；事实与营销适用性仍需真实ima检索及人工复核，不宣称审核通过。",
  "content": {
    "title": "第一台电脑，先装进上课的一天",
    "body": "从宿舍到教室，再去图书馆，第一台电脑要放进怎样的一天？先看每天怎么带，再看每天怎么用。\n\n把重量变成有画面的数字：HUAWEI MateBook 14（鸿蒙版）的圆键盘版本约1.33 kg（含电池）[S1]，约相当于2.7份500 mL水的重量，不含瓶。这里只比较重量；出门时还要算上充电器和其他物品。实际机身重量会因配置、制造工艺和测量方法不同而有差异[S1]。\n\n课堂笔记和小组作业，也要用自己的任务来判断。它采用HarmonyOS 6，屏幕比例为3:2[S1]；这些规格不能替代常用软件适配验证。把专业软件名称、版本和一份脱敏作业样例列出来，到店按真实操作顺序核对。\n\n还要认清版本：方键盘版本约1.32 kg（含电池），不要把方键盘与圆键盘的重量口径混用[S1]。配图为产品外观示意，不是课堂实拍或个人体验记录。\n\n#大学新生 #第一台电脑 #到店体验",
    "call_to_action": "先告诉我们专业和常用软件，确认演示条件后，带常用背包到店，一起核对你的上课任务。"
  },
  "image_plan": [
    {
      "source_ref": "I1",
      "position": "首图：位于标题与正文之间，展示目标型号圆键盘款式外观。",
      "caption": "原野绿多彩配色，HUAWEI MateBook 14（鸿蒙版）圆键盘外观示意。重量依据见产品资料，不能把外观图当实测证据。"
    },
    {
      "source_ref": "I2",
      "position": "“把重量变成有画面的数字”段落之后：补充同型号圆键盘外观；换算只作为文字，不篡改产品图。",
      "caption": "樱粉金产品外观，圆键盘款式。图片不是课堂或背包使用实拍，颜色和销售配置需另行确认。"
    },
    {
      "source_ref": "I3",
      "position": "“还要认清版本”段落之后：辅助辨别方键盘款式，避免混用重量。",
      "caption": "深空灰沉稳配色，方键盘外观示意。该图不代表上文圆键盘版本；两种重量口径需分别核对。"
    }
  ],
  "sales_plan": {
    "quote": "暂不报价：本次没有当期具体SKU、价格和优惠适用规则，预算也未确认。先确认键盘、内存、存储和屏幕版本，再由获授权人员核对有效价格及优惠条件；不自动计算或叠加优惠。",
    "demo_script": "0—30秒：确认专业、常用软件版本与需求排序；记录预算和配置缺口。若顾客尚不清楚，先建立待核对清单，不宣布推荐结论。\n30—90秒：先核对样机型号与键盘版本；在允许拿取的条件下，请顾客将样机与实际充电器放入常用背包体验。观察装包尺寸和携带感受；没有目标样机或背包时只记待体验，不将他款体验替代本款。\n90—150秒：确认样机具备所需软件及使用权限后，用获授权的脱敏样例尝试打开、编辑和保存；记录具体软件版本与步骤。软件、账号或样例不齐全就停止这一项，安排后续验证，不说“都兼容”。\n150—180秒：一起记录已体验、未完成和需再次确认的项目；确认是否愿意继续联系及适合的时间，不把演示计划写成验证已通过。"
  },
  "follow_up": [
    {
      "day": 1,
      "message": "方便的话，请补充专业、常用软件名称和版本，我们据此整理体验清单；暂时不清楚的项目可以先留空。"
    },
    {
      "day": 3,
      "message": "你关心的软件适配或携带问题还有哪些未确认？如果愿意，我们可以先核对样机和软件条件，再约一次针对性的到店体验。"
    },
    {
      "day": 7,
      "message": "你的选购时间或需求排序有变化吗？仍有未确认的任务，我们可以继续核对；如果暂时不需要，也可以告诉我们暂停联系。"
    }
  ],
  "source_refs": [
    "S1",
    "I1",
    "I2",
    "I3"
  ],
  "pending_confirmation": [
    "确认专业、常用软件及版本、文件格式；以目标型号和对应系统的实际验证结果判断适配，不从系统名称推断兼容。",
    "确认预算和具体键盘、内存、存储、屏幕配置；本稿展示两种键盘的区别，不代表已经选定可售SKU。",
    "确认当期价格、优惠条件与授权报价规则；本轮没有报价计算，不承诺库存或赠品。",
    "三张配图为本地知识库素材夹具，非本轮ima返回。真实联调必须重新取得指定库内对应图片与编号，并核对款式、可访问性和使用权限；不得把本样例当作真实运行结果。",
    "模型文案、换算和营销适用性仍需人工复核；来源编号存在或结构校验通过不等于逐句事实审核通过。",
    "跟进内容是草稿，须在取得顾客联系许可并结合实际进度后由店员使用，不自动发送。"
  ]
}
