{
  "customer_insight": "已知：客户经常跨地点开会，主要处理会议文档和表格，担心现有软件、文件及外设适配。\n已确认优先级：软件与外设适配＞屏幕阅读＞携带。首要任务是验证原有工作流程，不能用轻便替代适配判断。\n待确认：软件与插件名称、版本、文件格式、会议与外设条件、预算、具体销售配置；没有实测结果。",
  "strategy": "门店海报用一个任务标题、一个副标题和最多三条信息；优先回应软件与文件适配顾虑。产品采用HarmonyOS 6和3:2屏幕[S1]，只陈述规格并提出体验任务，不宣称软件已经兼容。使用一张产品主视觉，行动引导是咨询体验条件，不编造促销活动。",
  "content": {
    "title": "把你的工作任务，带来试一试",
    "body": "HUAWEI MateBook 14（鸿蒙版）\n换机前，先核对工作流程\n\nHarmonyOS 6，常用软件需逐项确认[S1]\n3:2屏幕，用真实文档体验阅读方式[S1]\n先确认样机与软件条件，再安排到店体验",
    "call_to_action": "咨询店员，准备你的任务验证清单。"
  },
  "image_plan": [
    {
      "source_ref": "I1",
      "position": "海报中部唯一主视觉，标题下方；保留原始比例，不拉伸。",
      "caption": "原野绿圆键盘产品外观示意，不代表软件适配验证结果；销售款式另行确认。"
    }
  ],
  "sales_plan": {
    "quote": "暂不报价：本次没有当期具体SKU、价格和优惠适用规则，预算也未确认。先确认键盘、内存、存储和屏幕版本，再由获授权人员核对有效价格及优惠条件；不自动计算或叠加优惠。",
    "demo_script": "0—30秒：确认最重要的工作任务、软件版本、文件和外设条件；若信息不齐，先记录而不承诺兼容。\n30—90秒：核对目标样机和使用权限；用获授权的脱敏文档按打开、修改、保存顺序操作，记录实际软件版本与失败步骤；缺软件、账号或样例就转为待验证。\n90—150秒：在前述条件满足时查看表格字号、缩放与窗口安排；允许拿取且装备齐全时再试装包。不得仅凭屏幕比例或重量宣布效率提升。\n150—180秒：与客户分别记录已完成、未完成和需要单位授权人员确认的项目，约定是否继续沟通及下一步。"
  },
  "follow_up": [
    {
      "day": 1,
      "message": "方便的话，请提供常用软件及版本、文件格式和外设名称即可，不需要提供账号密码或未脱敏业务文件，我们据此准备验证清单。"
    },
    {
      "day": 3,
      "message": "工作流程里还有哪些环节没确认？如果希望到店，我们先核对目标样机、软件和外设演示条件，再约时间。"
    },
    {
      "day": 7,
      "message": "换机计划或必要软件清单有变化吗？仍需验证的项目可以继续整理；若目前不需要跟进，也可以告诉我们暂停联系。"
    }
  ],
  "source_refs": [
    "S1",
    "I1"
  ],
  "pending_confirmation": [
    "确认软件、插件、文件格式、外设和单位管理条件；现有证据没有证明这些任务已适配。",
    "确认预算与具体SKU、当期价格和优惠规则，暂不报价。",
    "本地单张主视觉须通过真实ima重新获取、映射和核对使用权限；未提供的门店地址、活动与库存信息不填写。",
    "样例不是实测或真实生成记录，实际成稿需重新检索、生成及人工复核。",
    "跟进草稿须在获得联系许可且符合实际进度时使用，不自动发送。"
  ]
}
