{
  "customer_insight": "已知：学生需要每天携带电脑，顾虑软件适配。本次两条测试资料对同一圆键盘含电池重量给出不同数字[S1][S2]；不能据此形成可信的重量卖点。",
  "strategy": "停止生成营销成稿和生活化换算。S1记录圆键盘约1.33 kg，S2是故意构造的测试冲突记录[S1][S2]，本例没有足够的版本、日期或更正关系可消解分歧。请人工核对目标配置、资料原文与有效版本，再重新生成；不得选更轻的数字继续宣传。",
  "content": {
    "title": "",
    "body": "",
    "call_to_action": ""
  },
  "image_plan": [],
  "sales_plan": {
    "quote": "暂不报价；资料冲突尚未解决，具体SKU与有效价格规则均需确认。",
    "demo_script": "0—30秒：与店员确认目标型号和键盘配置。\n30—90秒：核对两条来源的原文、日期、配置和重量口径，不向顾客展示未经确认的重量结论。\n90—150秒：联系有权核实资料的人员记录更正结果；当前不能消解冲突则停止产品演示结论，保留待验证。\n150—180秒：告知仍需确认的项目；证据完成核对后再安排生成和体验，不冒称问题已解决。"
  },
  "follow_up": [
    {
      "day": 1,
      "message": "为避免把不同款式资料混在一起，方便确认你关注的具体配置吗？相关参数还在核对，暂不作结论。"
    },
    {
      "day": 3,
      "message": "如果你仍希望体验，我们会先确认目标型号和资料条件，再与你商量时间；未核实的参数不会作为推荐依据。"
    },
    {
      "day": 7,
      "message": "目前选购计划是否有变化？还有待核对的需求可以继续记录；如暂时不需要，可暂停联系。"
    }
  ],
  "source_refs": [
    "S1",
    "S2"
  ],
  "pending_confirmation": [
    "资料冲突阻断成稿：需人工核对S1与S2的型号、配置、重量口径、日期及更正关系；未解决前content保持空字符串。",
    "S2是人为构造的异常测试资料，不是官方事实，不得进入生产知识库或真实宣传。",
    "已保留需求；后续真实生成还需取得对应图片、确认软件适配和联系许可。"
  ]
}
