{
  "customer_insight": "已知：目标人群是第一次购机的大学新生；每天携带电脑上课，用于课堂笔记和小组作业，顾虑是常用软件能否适配。\n已确认优先级：轻便＞常用软件适配＞屏幕，来自本次notes。轻便决定内容开篇，软件适配是购买前必须核对的条件，不能因排序第二而跳过。\n待确认：专业、常用软件及版本、预算、具体键盘/内存/存储/屏幕款式。没有证据支持客户已选定配置或已经体验满意。",
  "strategy": "沿用客户确认的轻便优先，把跨教学楼携带压缩成一个场景；朋友圈只讲重量这个核心事实，不保留小红书的多段讨论与话题标签。圆键盘版本约1.33 kg（含电池），具体重量有配置等差异[S1]。只配一张明确匹配圆键盘的产品外观图；以准备到店体验清单收尾，不编造价格或兼容性。",
  "content": {
    "title": "每天带去上课，先试试怎么装包",
    "body": "每天往返教室和图书馆，电脑怎么带也值得先试。HUAWEI MateBook 14（鸿蒙版）圆键盘版本约1.33 kg（含电池），实际重量因配置、制造工艺和测量方法不同可能有差异[S1]。充电器等物品另计，常用软件也需逐项核验。",
    "call_to_action": "告诉我们专业与常用软件，确认演示条件后，带背包到店试试。"
  },
  "image_plan": [
    {
      "source_ref": "I1",
      "position": "朋友圈正文附图，共1张；使用原始比例展示产品外观。",
      "caption": "原野绿圆键盘外观示意，HUAWEI MateBook 14（鸿蒙版）。不代表课堂实拍、软件运行或携带体验。"
    }
  ],
  "sales_plan": {
    "quote": "暂不报价：本次没有当期具体SKU、价格和优惠适用规则，预算也未确认。先确认键盘、内存、存储和屏幕版本，再由获授权人员核对有效价格及优惠条件；不自动计算或叠加优惠。",
    "demo_script": "0—30秒：确认专业、常用软件版本与需求排序；记录预算和配置缺口。若顾客尚不清楚，先建立待核对清单，不宣布推荐结论。\n30—90秒：先核对样机型号与键盘版本；在允许拿取的条件下，请顾客将样机与实际充电器放入常用背包体验。观察装包尺寸和携带感受；没有目标样机或背包时只记待体验，不将他款体验替代本款。\n90—150秒：确认样机具备所需软件及使用权限后，用获授权的脱敏样例尝试打开、编辑和保存；记录具体软件版本与步骤。软件、账号或样例不齐全就停止这一项，安排后续验证，不说“都兼容”。\n150—180秒：一起记录已体验、未完成和需再次确认的项目；确认是否愿意继续联系及适合的时间，不把演示计划写成验证已通过。"
  },
  "follow_up": [
    {
      "day": 1,
      "message": "方便的话，请补充专业、常用软件名称和版本，我们据此整理体验清单；暂时不清楚的项目可以先留空。"
    },
    {
      "day": 3,
      "message": "你关心的软件适配或携带问题还有哪些未确认？如果愿意，我们可以先核对样机和软件条件，再约一次针对性的到店体验。"
    },
    {
      "day": 7,
      "message": "你的选购时间或需求排序有变化吗？仍有未确认的任务，我们可以继续核对；如果暂时不需要，也可以告诉我们暂停联系。"
    }
  ],
  "source_refs": [
    "S1",
    "I1"
  ],
  "pending_confirmation": [
    "确认专业、常用软件及版本、文件格式；以目标型号和对应系统的实际验证结果判断适配，不从系统名称推断兼容。",
    "确认预算和具体键盘、内存、存储、屏幕配置；本稿展示两种键盘的区别，不代表已经选定可售SKU。",
    "确认当期价格、优惠条件与授权报价规则；本轮没有报价计算，不承诺库存或赠品。",
    "本地示例仅用1张圆键盘外观图，真实运行需由指定ima库返回对应图片编号，核对款式和使用权限。",
    "模型文案、换算和营销适用性仍需人工复核；来源编号存在或结构校验通过不等于逐句事实审核通过。",
    "跟进内容是草稿，须在取得顾客联系许可并结合实际进度后由店员使用，不自动发送。"
  ]
}
